image_url,item
https://s3-us-west-2.amazonaws.com/gregpuzzles1/images/waterford+crystal+glasses.jpg,Marquis by Waterford Brookside 12-Ounce Double Old Fashion Glasses Set of 4
https://s3-us-west-2.amazonaws.com/gregpuzzles1/images/Quilted+Northern+48+rolls.jpg,Quilted Northern Ultra Plush Bath Tissue 48 Double Rolls
https://s3-us-west-2.amazonaws.com/gregpuzzles1/images/weed+eater.jpg,GreenWorks 21212 4Amp 13-Inch Corded String Trimmer
https://s3-us-west-2.amazonaws.com/gregpuzzles1/images/Aylio+seat.jpg,Aylio Coccyx Orthopedic Comfort Foam Seat Cushion (Gray)
https://s3-us-west-2.amazonaws.com/gregpuzzles1/images/utensils+Joseph+6-piece.jpg,Joseph Joseph 6-Piece Kitchen Utensil Set with Storage Carousel Elevate Multi-color
https://s3-us-west-2.amazonaws.com/gregpuzzles1/images/brass+shower+head.jpg,"Kingston Brass K136A5 Designer Trimscape Showerscape 8"" Round Shower Head Oil Rubbed Bronze"
https://s3-us-west-2.amazonaws.com/gregpuzzles1/images/golf+bag.jpg,Club Champ Golf Bag Travel Cover
https://s3-us-west-2.amazonaws.com/gregpuzzles1/images/cookware+10-piece+green.jpg,Cook N Home NC-00358 Nonstick Ceramic Coating 10-Piece Cookware Set Green
https://s3-us-west-2.amazonaws.com/gregpuzzles1/images/Bissel+bagless+vacuum.jpg,BISSELL Zing Bagless Canister Vacuum Caribbean Blue
https://s3-us-west-2.amazonaws.com/gregpuzzles1/images/Weber+gas+grill+cover.jpg,Weber 7552 Premium Cover Fits Weber Genesis Silver/Gold Gas Grills
https://s3-us-west-2.amazonaws.com/gregpuzzles1/images/Glasslock+18+piece+containers.jpg,Glasslock 18-Piece Assorted Oven Safe Container Set
https://s3-us-west-2.amazonaws.com/gregpuzzles1/images/Hamilton+Beach+juicer.jpg,Hamilton Beach 67601A Big Mouth Juice Extractor Black
https://s3-us-west-2.amazonaws.com/gregpuzzles1/images/Flowtron+bug+zapper.jpg,Flowtron BK-15D Electronic Insect Killer 1/2 Acre Coverage
https://s3-us-west-2.amazonaws.com/gregpuzzles1/images/wooden+train+track.jpg,Wooden Train Track 100 Piece Pack - 100% Compatible with All Major Brands including Thomas Wooden Railway System
https://s3-us-west-2.amazonaws.com/gregpuzzles1/images/T-fal+pan+orange.jpg,T-fal C97107 Excite Nonstick Thermo-Spot Dishwasher Safe Oven Safe Fry Pan Cookware 12-Inch Orange
https://s3-us-west-2.amazonaws.com/gregpuzzles1/images/dog+house.jpg,Suncast DH250 Dog House
https://s3-us-west-2.amazonaws.com/gregpuzzles1/images/ironing+board.jpg,Household Essentials Tabletop Sleeve Ironing Board with Steel Top
https://s3-us-west-2.amazonaws.com/gregpuzzles1/images/Bolle+Carve+snow+goggles.jpg,Bolle Carve Snow Goggles Black
https://s3-us-west-2.amazonaws.com/gregpuzzles1/images/Green+Bay+Packers+hard+hat.jpg,MSA Safety Works NFL Hard Hat Green Bay Packers
https://s3-us-west-2.amazonaws.com/gregpuzzles1/images/security+bar.jpg,Master Lock 265DCCSEN Dual-Function Security Bar
https://s3-us-west-2.amazonaws.com/gregpuzzles1/images/laptop+projector+stand.jpg,Pyle Laptop Projector Stand Heavy Duty Tripod Height Adjustable 16'' To 28' For DJ Presentations Notebook Computer
https://s3-us-west-2.amazonaws.com/gregpuzzles1/images/archery+target.jpg,"Black Hole Archery Target 18"""
https://s3-us-west-2.amazonaws.com/gregpuzzles1/images/rolling+pin.jpg,Fox Run Brands White Marble Rolling Pin with Wood Base
https://s3-us-west-2.amazonaws.com/gregpuzzles1/images/meat+tendrizer.jpg,iPerfect Kitchen 56 Stainless Steel Blades Meat Tenderizer with Cleaning Brush - Set of 1 - Black
https://s3-us-west-2.amazonaws.com/gregpuzzles1/images/Fisher-Price+manger+scene.jpg,Fisher-Price Little People A Christmas Story
https://s3-us-west-2.amazonaws.com/gregpuzzles1/images/53-piece+toolkit.jpg,Apollo Precision Tools DT9408 Household Tool Kit 53-Piece
https://s3-us-west-2.amazonaws.com/gregpuzzles1/images/Marpac+white+noise.jpg,Marpac DOHM-DS Natural White Noise (actual fan inside) Sound Machine Tan
https://s3-us-west-2.amazonaws.com/gregpuzzles1/images/reflective+triange.jpg,Deflect-O RSMVT Slow Moving Vehicle Reflective Triangle
https://s3-us-west-2.amazonaws.com/gregpuzzles1/images/daypack+UN+Navy.jpg,Fjallraven Kanken Daypack Color: UN Navy
https://s3-us-west-2.amazonaws.com/gregpuzzles1/images/shoe+storage.jpg,Songmics 7 Tiers Shoe Rack Closet with Fabric Cover Portable Shoe Storage Organizer Cabinet Dark Brown URXJ12Z
https://s3-us-west-2.amazonaws.com/gregpuzzles1/images/dog+feeder.jpg,Little Giant 25 Lb Chow Hound Galvanized Dog Feeder CH25
https://s3-us-west-2.amazonaws.com/gregpuzzles1/images/Zwipes+36+count.jpg,Zwipes Microfiber Cleaning Cloths (36-Pack) Assorted Colors
https://s3-us-west-2.amazonaws.com/gregpuzzles1/images/picnic+table.jpg,Merry Garden Interchangeable Picnic Table and Garden Bench
https://s3-us-west-2.amazonaws.com/gregpuzzles1/images/Piccadilly+picnic+basket.jpg,Picnic Time Piccadilly 16-Inch Double-Lid Picnic Basket with Service for 2
https://s3-us-west-2.amazonaws.com/gregpuzzles1/images/NASCAR.jpg,NASCAR CHECKERED 3 X 5 BANNER FLAG
https://s3-us-west-2.amazonaws.com/gregpuzzles1/images/tire+storage.jpg,HyLoft Model 01012 Tire-Loft Multi Tire Storage System 48-Inch wide by 36-Inch Deep
https://s3-us-west-2.amazonaws.com/gregpuzzles1/images/soccer+ball.jpg,adidas Performance Finale Berlin Capitano Soccer Ball Color: Yellow
https://s3-us-west-2.amazonaws.com/gregpuzzles1/images/Family+Doctor+14+essential+oils.jpg,Family Doctor (14) Essential Oil Set 100% Pure Best Therapeutic Grade - 14/10mL (Aromatherapy Kit Physician Series Makes Great Gift Includes: Breathe Eucalyptus Health Shield Frankincense Good Night Head Ease French Lavender Muscle Relief Sweet Orange Peppermint Pharma Grade Relaxation Rosemary Stress Relief and Tea Tree
https://s3-us-west-2.amazonaws.com/gregpuzzles1/images/EdenPURE+heating+elements.jpg,Complete OEM Set of Sylvania 1500 watt EdenPURE GEN4 & USA1000 Bulb Kit Complete. AirnMore is a recognized service center
https://s3-us-west-2.amazonaws.com/gregpuzzles1/images/printer+stand.jpg,Safco Products 5206BL Under Desk Printer/Machine Stand Black
https://s3-us-west-2.amazonaws.com/gregpuzzles1/images/T-fal+pan+green.jpg,T-fal C96807 Excite Nonstick Thermo-Spot Dishwasher Safe Oven Safe Fry Pan Cookware 11.5-Inch Green
https://s3-us-west-2.amazonaws.com/gregpuzzles1/images/laptop+desk+Cooler+Master.jpg,Cooler Master Comforter - Laptop Lap Desk with Pillow Cushion - Black (C-HS02-KA)
https://s3-us-west-2.amazonaws.com/gregpuzzles1/images/exercise+playmat.jpg,9-tile Multi-color Exercise Mat Solid Foam EVA Playmat Kids Safety Play Floor by Poco Divo
https://s3-us-west-2.amazonaws.com/gregpuzzles1/images/daypack+graphite+UN+Blue.jpg,Fjallraven Kanken Daypack Color: Graphite/UN Blue
https://s3-us-west-2.amazonaws.com/gregpuzzles1/images/Carrom+board+game.jpg,Carrom Game Board Large
https://s3-us-west-2.amazonaws.com/gregpuzzles1/images/chair+protector.jpg,Elegance Linen Quilted Pet Dog Children Kids Furniture Protector Microfiber Slip Cover Chair Navy Blue
https://s3-us-west-2.amazonaws.com/gregpuzzles1/images/corral+set.jpg,Breyer Stablemates Red Stable Set
https://s3-us-west-2.amazonaws.com/gregpuzzles1/images/terrarium+kit.jpg,DuneCraft Dome Terrariums - Herbs
https://s3-us-west-2.amazonaws.com/gregpuzzles1/images/hammock.jpg,Blue Sky Outdoor Mosquito Traveler Hammock with Free Tree Straps Green
https://s3-us-west-2.amazonaws.com/gregpuzzles1/images/pencil+sharpner.jpg,X-Acto Model KS Table- or Wall-Mount Pencil Sharpener (1031)
https://s3-us-west-2.amazonaws.com/gregpuzzles1/images/archery+storage.jpg,Plano Protector Compact Bow Case (Black)
https://s3-us-west-2.amazonaws.com/gregpuzzles1/images/salt%26pepper.jpg,Salt & Pepper Mill Set 2 in 1 - Salt and Pepper Grinder Set with Adjustable Ceramic Grinding Mechanism - Premium Quality Stainless Steel
https://s3-us-west-2.amazonaws.com/gregpuzzles1/images/Glad+trash+bags+30+gl+50+liners.jpg,Glad ForceFlex Extra Strong Outdoor Drawstring Large Trash Bags 30 Gallon 50 Bags
https://s3-us-west-2.amazonaws.com/gregpuzzles1/images/pet+barrier.jpg,Solvit Front Seat Net Pet Barrier
https://s3-us-west-2.amazonaws.com/gregpuzzles1/images/daypack+burnt+orange.jpg,Fjallraven Kanken Daypack Color: Burnt Orange
https://s3-us-west-2.amazonaws.com/gregpuzzles1/images/Willow+Tree+shepherd.jpg,Willow Tree Shepherd and Stable Animals
https://s3-us-west-2.amazonaws.com/gregpuzzles1/images/kayak+storage+sling.jpg,Malone Auto Racks SlingTwo Double Kayak Storage System
https://s3-us-west-2.amazonaws.com/gregpuzzles1/images/helium+shark.jpg,Air Swimmers Remote Control Flying Shark
https://s3-us-west-2.amazonaws.com/gregpuzzles1/images/daypack+peach+pink.jpg,Fjallraven Kanken Daypack Color: Peach Pink
https://s3-us-west-2.amazonaws.com/gregpuzzles1/images/clock+radio.jpg,iLive iKB333S Under Cabinet Radio with Bluetooth Speakers (Silver)
https://s3-us-west-2.amazonaws.com/gregpuzzles1/images/Emoji+backpack.jpg,Hynes Eagle Cute Emoji Backpack Cool Kids School Backpack Color: Black
https://s3-us-west-2.amazonaws.com/gregpuzzles1/images/daypack+cafe+mint.jpg,Fjallraven Kanken Daypack Color: Cafe mint
https://s3-us-west-2.amazonaws.com/gregpuzzles1/images/keyboard+bench.jpg,TMSﾮ Adjustable Leather Padded Piano Keyboard Bench Seat with Rubber Feet Stool Chair
